{
    "$schema": "./LineSchema.json",
    "frequent": true,
    "lineNumber": 57,
    "lineName": "Cote-Vertu",
    "from": "Pierre Elliott Trudeau Intl Airport",
    "to": "Station Saint-Michel",
    "stops": {
        "1": "Pierre Elliott Trudeau Intl Airport",
        "2": "Cote-Vertu / Pitfield",
        "3": "Cote-Vertu / Saint-Amour",
        "4": "Cote-Vertu / Montee de Liesse",
        "5": "Cote-Vertu / Begin",
        "6": "Cote-Vertu / No 3695",
        "7": "Cote-Vertu / Beaulac",
        "8": "Cote-Vertu / No 3200",
        "9": "Cote-Vertu / Cavendish",
        "10": "Cote-Vertu / Hocquart",
        "11": "Cote-Vertu / Bertrand",
        "12": "Cote-Vertu / Alexis-Nihon",
        "13": "Cote-Vertu / Saint-Aubin",
        "14": "Cote-Vertu / Marcel-Laurin",
        "15": "Cote-Vertu / Leduc",
        "16": "Cote-Vertu / Crevier",
        "17": "Station Cote-Vertu",
        "18": "Cote-Vertu / Saint-Germain",
        "19": "Cote-Vertu / Sainte-Croix",
        "20": "Cote-Vertu / Dutrisac",
        "21": "Cote-Vertu / Barre",
        "22": "Cote-Vertu / Montpellier",
        "23": "Cote-Vertu / Latour",
        "24": "Cote-Vertu / Muir",
        "25": "Cote-Vertu / Jules-Poitras",
        "26": "Cote-Vertu / Lebeau",
        "27": "Sauve / Elzear-Soucy",
        "28": "Sauve / de l'Acadie",
        "29": "Gare Ahuntsic",
        "30": "de l'Acadie / Louvain",
        "31": "de l'Acadie / Mazurette",
        "32": "de l'Acadie / Chabanel",
        "33": "de l'Acadie / Antonio-Barbeau",
        "34": "de l'Acadie / Legendre",
        "35": "de l'Acadie / Beauharnois",
        "36": "Cremazie / d'Outremont",
        "37": "Cremazie / Bloomfield",
        "38": "Cremazie / Querbes",
        "39": "Cremazie / Jeanne-Mance",
        "40": "Cremazie / de l'Esplanade",
        "41": "Cremazie / de Reims",
        "42": "Cremazie / Saint-Laurent",
        "43": "Cremazie / de Gaspe",
        "44": "Station Cremazie",
        "45": "Cremazie / Foucher",
        "46": "Cremazie / Saint-Hubert",
        "47": "Cremazie / Christophe-Colomb",
        "48": "Cremazie / Chambord",
        "49": "Cremazie / Rousselot",
        "50": "Cremazie / Fabre",
        "51": "Cremazie / Papineau",
        "52": "Cremazie / Chabot",
        "53": "Cremazie / de Lorimier",
        "54": "Cremazie / des Ecores",
        "55": "Cremazie / d'Iberville",
        "56": "Cremazie / 1e Avenue",
        "57": "Cremazie / 6e Avenue",
        "58": "Cremazie / 9e Avenue",
        "59": "Cremazie / Saint-Michel",
        "60": "Station Saint-Michel"
    }
}