{
    "$schema": "./LineSchema.json",
    "frequent": true,
    "lineNumber": 142,
    "lineName": "Sauve",
    "from": "Gare Ahuntsic",
    "to": "Gare Saint-Michel-Montreal-Nord",
    "stops": {
        "1": "Gare Ahuntsic (de l'Acadie / Sauve)",
        "2": "Sauve / Meilleur",
        "3": "Sauve / Verville",
        "4": "Sauve / Tolhurst",
        "5": "Sauve / de l'Esplanade",
        "6": "Sauve / Saint-Urbain",
        "7": "Sauve / Saint-Laurent",
        "8": "Sauve / Laverdure",
        "9": "Station Sauve",
        "10": "Sauve / Lajeunesse",
        "11": "Sauve / Millen",
        "12": "Sauve / Saint-Hubert",
        "13": "Sauve / Saint-Charles",
        "14": "Sauve / de la Roche",
        "15": "Sauve / Christophe-Colomb",
        "16": "Sauve / Curotte",
        "17": "Sauve / Garnier",
        "18": "Sauve / Papineau",
        "19": "Sauve / Charton",
        "20": "Sauve / de Saint-Firmin",
        "21": "Sauve / Parthenais",
        "22": "Sauve / de Lille",
        "23": "Sauve / d'Iberville",
        "24": "Sauve / Sackville",
        "25": "Sauve / Larose",
        "26": "Sauve / Saint-Michel",
        "27": "Saint-Michel / Industriel",
        "28": "Industriel / du Parc-Georges",
        "29": "Industriel / Saint-Vital",
        "30": "Industriel / de Paris",
        "31": "Industriel / des Recollets",
        "32": "Gare Saint-Michel-Montreal-Nord"
    }
}