{
    "$schema": "./LineSchema.json",
    "frequent": true,
    "lineNumber": 440,
    "lineName": "EXPRESS Pie-IX",
    "from": "Station Pie-IX",
    "to": "Marie-Victorin / No 7000",
    "stops": {
        "1": "Station Pie-IX",
        "2": "SRB Pie-IX / du Mont-Royal",
        "3": "SRB Pie-IX / Laurier",
        "4": "SRB Pie-IX / Rosemont",
        "5": "SRB Pie-IX / Beaubien",
        "6": "SRB Pie-IX / Belanger",
        "7": "SRB Pie-IX / Jean-Talon",
        "8": "SRB Pie-IX / Jarry",
        "9": "SRB Pie-IX / Robert",
        "10": "SRB Pie-IX / 39e Rue",
        "11": "SRB Pie-IX / 47e Rue",
        "12": "SRB Pie-IX / 56e Rue",
        "13": "SRB Pie-IX / Fleury",
        "14": "SRB Pie-IX / de Castille",
        "15": "SRB Pie-IX / d'Amos",
        "16": "Carrefour Henri-Bourassa / Pie-IX",
        "17": "Henri-Bourassa / Pelletier",
        "18": "Henri-Bourassa / Sainte-Gertrude",
        "19": "Henri-Bourassa / Salk",
        "20": "Henri-Bourassa / Sainte-Colette",
        "21": "CLSC de Montreal-Nord",
        "22": "Lacordaire / Crevier",
        "23": "Lacordaire / Maurice-Duplessis",
        "24": "Maurice-Duplessis / Desy",
        "25": "Maurice-Duplessis / Rolland",
        "26": "Maurice-Duplessis / Matte",
        "27": "Maurice-Duplessis / Langelier",
        "28": "Maurice-Duplessis / Albert-Hudon",
        "29": "Maurice-Duplessis / No 7000",
        "30": "Marie-Victorin / No 7000"
    }
}