{
    "$schema": "./LineSchema.json",
    "frequent": false,
    "lineNumber": 11,
    "lineName": "de la Verendrye",
    "from": "Lafleur / LaSalle",
    "to": "Station Jolicoeur",
    "stops": {
        "1": "Lafleur / LaSalle",
        "2": "LaSalle / Orchard",
        "3": "LaSalle / 90e Avenue",
        "4": "90e Avenue / Red Cross",
        "5": "90e Avenue / Airlie",
        "6": "Airlie / 80e Avenue",
        "7": "Airlie / 76e Avenue",
        "8": "de la Verendrye / Dollard",
        "9": "Dollard / Champlain",
        "10": "Champlain / 35e Avenue",
        "11": "Champlain / No 8398",
        "12": "Champlain / Raymond",
        "13": "Champlain / Gagne",
        "14": "Champlain / Bishop-Power",
        "15": "Bishop-Power / Bourdeau",
        "16": "Bourdeau / Jacqueline-Sicotte",
        "17": "Bourdeau / Therry",
        "18": "Bourdeau / Lapierre",
        "19": "Parc Angrignon",
        "20": "de la Verendrye / Trinitaires",
        "21": "Trinitaires / d'Aragon",
        "22": "Trinitaires / Jogues",
        "23": "Trinitaires / Lamont",
        "24": "Station Angrignon"
    }
}