{
    "$schema": "./LineSchema.json",
    "frequent": false,
    "lineNumber": 211,
    "lineName": "Pointe-Claire",
    "from": "Pierre Elliott Trudeau Intl Airport",
    "to": "Gare Baurepiere",
    "stops": {
        "1": "Pierre Elliott Trudeau Intl Airport",
        "2": "Albert de Niverville / Cardinal",
        "3": "Cardinal / Stuart-Graham",
        "4": "Cardinal / Thorncrest",
        "5": "Gare Pine Beach",
        "6": "Cardinal / Meadowvale",
        "7": "Cardinal / Avila-Legault",
        "8": "Cardinal / Neptune",
        "9": "Cardinal / Strathmore",
        "10": "Cardinal / des Sources",
        "11": "Cardinal / Chester",
        "12": "Donegani / King",
        "13": "Gare Valois",
        "14": "Donegani / Broadview",
        "15": "Donegani / Matland",
        "16": "Donegani / Michigan",
        "17": "Gare Pointe-Claire",
        "18": "Donegani / Terra-Cotta",
        "19": "Donegani / Maywood",
        "20": "Donegani / Eldorado",
        "21": "Donegani / Aurora",
        "22": "Aurora / Springdale",
        "23": "Aurora / Douglas-Shand",
        "24": "Aurora / Duke-of-Kent",
        "25": "Aurora / Sedgefield",
        "26": "Sedgefield / Saint-Jean",
        "27": "Saint-Jean / Hymus",
        "28": "Hymus / Alston",
        "29": "Hymus / Stillview",
        "30": "Hymus / Andre-Brunet",
        "31": "Hymus / Eaton",
        "32": "Hymus / Chateauneuf",
        "33": "Hymus / Caravelle",
        "34": "Hymus / Saint-Charles",
        "35": "Saint-Charles / Kirkland",
        "36": "Saint-Charles / No 2768",
        "37": "Saint-Charles / Creswell",
        "38": "Saint-Charles / Sherbrooke",
        "39": "Saint-Charles / Evergreen",
        "40": "Gare Beaconsfield",
        "41": "Elm / Allancroft",
        "42": "Elm / Park",
        "43": "Elm / Fairway",
        "44": "Elm / Shannon-Park",
        "45": "Elm / Montrose",
        "46": "Elm / Alice-Cartiere",
        "47": "Gare Baurepiere"
    }
}