{
    "$schema": "./LineSchema.json",
    "frequent": false,
    "lineNumber": 101,
    "lineName": "Nuns Island",
    "from": "Campus Bell",
    "to": "Andre-Prevost",
    "stops": {
        "1": "Campus Bell",
        "2": "de la Pointe Nord / Jacques-Le-Ber",
        "3": "Station REM Ile-Des-Soeurs",
        "4": "Rene-Levesque / Champlain",
        "5": "Rene-Levesque / Levert",
        "6": "Rene-Levesque / du Commerce",
        "7": "du Commerce / Cite-de-l'Ile",
        "8": "du Commerce / Provigo",
        "9": "du Golf / No 210",
        "10": "du Golf / Camelias",
        "11": "du Golf / William-Paul",
        "12": "du Golf / Roland-Jeanneau",
        "13": "Marguerite-Bourgeoys / du Club Marin",
        "14": "Marguerite-Bourgeoys / de la Foret",
        "15": "Marguerite-Bourgeoys / de l'Ile-des-Soeurs",
        "16": "de l'Ile-des-Soeurs / Berlioz",
        "17": "de l'Ile-des-Soeurs / Corot",
        "18": "de l'Ile-des-Soeurs / Darwin",
        "19": "de l'Ile-des-Soeurs / Elgar",
        "20": "de l'Ile-des-Soeurs / de Gaspe",
        "21": "de l'Ile-des-Soeurs / Hall",
        "22": "de la Pointe Sud / Des Sommets",
        "23": "de la Pointe Sud / Parulines",
        "24": "de la Pointe Sud / No 250",
        "25": "de la Pointe Sud / Andre-Prevost",
        "26": "Andre-Prevost / Serge-Garant E",
        "27": "Andre-Prevost / Serge-Garant O"
    }
}