{
    "$schema": "./LineSchema.json",
    "frequent": false,
    "lineNumber": 72,
    "lineName": "de Lorimier",
    "from": "Station Papineau",
    "to": "Station Saint-Michel",
    "stops": {
        "1": "Station Papineau",
        "2": "de Maisonneuve / Papineau",
        "3": "Sainte-Catherine / de Lorimier",
        "4": "de Lorimier / de Maisonneuve",
        "5": "de Lorimier / Ontario",
        "6": "de Lorimier / de Rouen",
        "7": "de Lorimier / Sherbrooke",
        "8": "de Lorimier / Gauthier",
        "9": "de Lorimier / Rachel",
        "10": "de Lorimier / Marie-Anne",
        "11": "de Lorimier / du Mont-Royal",
        "12": "de Lorimier / Gilford",
        "13": "de Lorimier / Saint-Joseph",
        "14": "de Lorimier / Laurier",
        "15": "de Lorimier / Masson",
        "16": "de Lorimier / Holt",
        "17": "de Lorimier / Rosemont",
        "18": "de Lorimier / de Bellechasse",
        "19": "de Lorimier / Beaubien",
        "20": "de Lorimier / Saint-Zotique",
        "21": "de Lorimier / Belanger",
        "22": "de Lorimier / Jean-Talon",
        "23": "de Lorimier / Everett",
        "24": "de Lorimier / Villeray",
        "25": "de Lorimier / Tillemont",
        "26": "de Lorimier / Jarry",
        "27": "Cremazie / des Ecores",
        "28": "Cremazie / d'Iberville",
        "29": "Cremazie / 2e Avenue",
        "30": "Cremazie / 8e Avenue",
        "31": "Cremazie / Saint-Michel",
        "32" :"Saint-Michel / Villeray",
        "33": "Station Saint-Michel"
    }
}