{
    "$schema": "./LineSchema.json",
    "ooi-express": true,
    "frequent": false,
    "lineNumber": 901,
    "lineName": "EXPRESS Laval",
    "from": "Gare Centrale",
    "to": "Gare Vimont",
    "stops": {
        "1": "Gare Centrale",
        "2": "Mansfield / Rene-Levesque",
        "3": "Rene-Levesque / Peel",
        "4": "Rene-Levesque / Drummond",
        "5": "Rene-Levesque / de la Montagne",
        "6": "Rene-Levesque / Lucien-L'Allier",
        "7": "Rene-Levesque / Guy",
        "8": "Rene-Levesque / Saint-Mathieu",
        "9": "Rene-Levesque / Fort",
        "10": "Rene-Levesque / Atwater",
        "11": "Dorchester / Greene",
        "12": "Dorchester / Sainte-Catherine",
        "13": "Sainte-Catherine / Kensington",
        "14": "Sainte-Catherine / Melville",
        "15": "Sainte-Catherine / Lansdowne",
        "16": "Sainte-Catherine / Victoria",
        "17": "Sainte-Catherine / de Maisonneuve",
        "18": "Station Vendome",
        "19": "de Maissoneuve / Decarie",
        "20": "Decarie / Sherbrooke",
        "21": "Sherbrooke / Autoroute 15",
        "22": "de la Concorde / le Corbusier",
        "23": "Station Montmorency",
        "24": "de l'Avenir / de la Concorde",
        "25": "de la Concorde / Laval",
        "26": "Laval / Dube",
        "27": "Laval / des Pres",
        "28": "Laval / du Souvenir",
        "29": "Laval / du Trait-Carre",
        "30": "Laval / Jolivet",
        "31": "Laval / No 1700",
        "32": "Laval / Saint-Martin",
        "33": "Industriel / Salaberry",
        "34": "Industriel / Lippmann",
        "35": "Industriel / Munck",
        "36": "Industriel / Cunard",
        "37": "Industriel / Berlier",
        "38": "Industriel / Saint-Elzear",
        "39": "Industriel / Bergar",
        "40": "Industriel / Dagenais",
        "41": "Dagenais / Francis-Hughes",
        "42": "Gare Vimont"
    }
}