{
    "$schema": "./LineSchema.json",
    "frequent": true,
    "lineNumber": 125,
    "lineName": "Beaubien",
    "from": "Station Beaubien",
    "to": "Galeries d'Anjou",
    "stops": {
        "1": "Station Beaubien",
        "2": "Beaubien / Saint-Hubert",
        "3": "Beaubien / Christophe-Colomb",
        "4": "Beaubien / de Normanville",
        "5": "Beaubien / Lanaudiere",
        "6": "Beaubien / Fabre",
        "7": "Beaubien / Papineau",
        "8": "Beaubien / Chabot",
        "9": "Beaubien / de Lorimier",
        "10": "Beaubien / Louis-Hemon",
        "11": "Beaubien / d'Iberville",
        "12": "Beaubien / 1e Avenue",
        "13": "Beaubien / 6e Avenue",
        "14": "Beaubien / Saint-Michel",
        "15": "Beaubien / 13e Avenue",
        "16": "Beaubien / 16e Avenue",
        "17": "Beaubien / 18e Avenue",
        "18": "Beaubien / 20e Avenue",
        "19": "Beaubien / Pie-IX",
        "20": "Beaubien / 24e Avenue",
        "21": "Beaubien / 26e Avenue",
        "22": "Beaubien / 28e Avenue",
        "23": "Beaubien / 31e Avenue",
        "24": "Beaubien / 33e Avenue",
        "25": "Beaubien / 35e Avenue",
        "26": "Beaubien / Viau",
        "27": "Beaubien / 39e Avenue",
        "28": "Beaubien / 41e Avenue",
        "29": "Beaubien / 43e Avenue",
        "30": "Beaubien / Assomption",
        "31": "Beaubien / Chatelain",
        "32": "Beaubien / de Pontoise",
        "33": "Beaubien / Lacordaire",
        "34": "Beaubien / Place Beaubien",
        "35": "Beaubien / Albani",
        "36": "Beaubien / de Carignan",
        "37": "Beaubien / Langelier",
        "38": "Beaubien / Francois-Boivin",
        "39": "Beaubien / Pierre-Gadois",
        "40": "Beaubien / des Galeries-d'Anjou",
        "41": "des Galeries-d'Anjou / Saint-Zotique",
        "42": "des Galeries-d'Anjou / Belanger",
        "43": "Galeries d'Anjou"
    }
}