{
    "$schema": "./LineSchema.json",
    "frequent": false,
    "lineNumber": 52,
    "lineName": "Rene-Levesque",
    "from": "Ouest Ville Marie (Sherbrooke / Clarke)",
    "to": "Station Frontenac",
    "stops": {
        "1": "Sherbrooke / Clarke",
        "2": "Clarke / De Maisonneuve",
        "3": "Clarke / Saint-Catherine",
        "4": "Dorchester / Greene",
        "5": "Dorchester / Clandeboye",
        "6": "Dorchester / Atwater",
        "7": "Rene-Levesque / du Sussex",
        "8": "Rene-Levesque / Fort",
        "9": "Rene-Levesque / St Marc",
        "10": "Rene-Levesque / Guy",
        "11": "Rene-Levesque / Bishop",
        "12": "Rene-Levesque / de la Montagne",
        "13": "Rene-Levesque / Peel",
        "14": "Rene-Levesque / Mansfield",
        "15": "Rene-Levesque / Robert-Bourassa",
        "16": "Rene-Levesque / Beaver Hall",
        "17": "Rene-Levesque / de Bleury",
        "18": "Rene-Levesque / Saint-Urbain",
        "19": "Rene-Levesque / St-Laurent",
        "20": "Rene-Levesque / De Bullion",
        "21": "Rene-Levesque / Sanguinet",
        "22": "Rene-Levesque / Saint Denis",
        "23": "Rene-Levesque / Berri",
        "24": "Rene-Levesque / St-Hubert",
        "25": "Rene-Levesque / St Andre",
        "26": "Rene-Levesque / Wolfe",
        "27": "Rene-Levesque / Visitation",
        "28": "Rene-Levesque / Plessis",
        "29": "Rene-Levesque / Papineau",
        "30": "Rene-Levesque / De Lorimier",
        "31": "De Lorimier / Notre-Dame",
        "32": "Notre-Dame / Frontenac",
        "33": "Frontenac / de Maisonneuve",
        "34": "Frontenac / la Fontaine",
        "35": "Station Frontenac"
    }
}