{
    "$schema": "./LineSchema.json",
    "frequent": false,
    "lineNumber": 23,
    "lineName": "Westminster",
    "from": "Ecole Secondaire Bialik",
    "to": "Station Villa-Maria",
    "stops": {
        "1": "Ecole Secondaire Bialik",
        "2": "Kildare / Merrimac",
        "3": "Kildare / Rembrandt",
        "4": "Kildare / Cavendish",
        "5": "Kildare / Kellert",
        "6": "Kildare / Einstein",
        "7": "Kildare / Caldwell",
        "8": "Kildare / Trinity",
        "9": "Kildare / Melling",
        "10": "Kildare / Leger",
        "11": "Kildare / McAlear",
        "12": "Kildare / Westminster",
        "13": "Westminster / Guelph",
        "14": "Westminster / Cote-Saint-Luc",
        "15": "Westminster / Westover",
        "16": "Westminster / Radcliffe",
        "17": "Westminster / Parkside",
        "18": "Westminster / Nelson",
        "19": "Westminster / Curzon",
        "20": "Sherbrooke / Brock",
        "21": "Gare Montreal West",
        "22": "Sherbrooke / West Broadway",
        "23": "Monkland / Mayfair",
        "24": "Monkland / Rosedale",
        "25": "Monkland / Montclair",
        "26": "Monkland / Walkley",
        "27": "Monkland / Cavendish",
        "28": "Monkland / Benny",
        "29": "Monkland / Madison",
        "30": "Monkland / Grand Blvd",
        "31": "Monkland / Hingston",
        "32": "Monkland / Royal",
        "33": "Monkland / Melrose",
        "34": "Monkland / Harvard",
        "35": "Monkland / Marcil",
        "36": "Monkland / Girouard",
        "37": "Station Villa-Maria"
    }
}