{
    "$schema": "./LineSchema.json",
    "frequent": false,
    "lineNumber": 123,
    "lineName": "Maurice-Duplessis",
    "from": "Gare Anjou",
    "to": "Gare Pointe-aux-Trembles",
    "stops": {
        "1": "Gare Anjou",
        "2": "6e Avenue / Henri-Bourassa",
        "3": "Louis.-H.-Lafontaine / Arthur-Leveille",
        "4": "Louis.-H.-Lafontaine / Maurice-Duplessis",
        "5": "Maurice-Duplessis / 5e Avenue",
        "6": "Maurice-Duplessis / Pierre-Blanchet",
        "7": "Maurice-Duplessis / Gilbert-Barbier",
        "8": "Maurice-Duplessis / Marc-Aurele-Fortin",
        "9": "Maurice-Duplessis / Fernand-Gauthier",
        "10": "Maurice-Duplessis / la Valiniere",
        "11": "Maurice-Duplessis / Camille-Tessier",
        "12": "Maurice-Duplessis / Dom-Bellot",
        "13": "Maurice-Duplessis / Armand-Bombardier",
        "14": "Maurice-Duplessis / Clement-Ader",
        "15": "Maurice-Duplessis / 27e Avenue",
        "16": "Maurice-Duplessis / Eva-Circe",
        "17": "Maurice-Duplessis / Andre-Dumas",
        "18": "Maurice-Duplessis / Rita-Levi-Montalcini",
        "19": "Maurice-Duplessis / Pierre-Baillargeon",
        "20": "Maurice-Duplessis / 41e Avenue",
        "21": "Maurice-Duplessis / Rodolphe-Forget",
        "22": "Maurice-Duplessis / J.-J.-Joubert",
        "23": "Maurice-Duplessis / Jean-Yves-Bigras",
        "24": "Maurice-Duplessis / 54e Avenue",
        "25": "Maurice-Duplessis / 57e Avenue",
        "26": "Maurice-Duplessis / Riviere-des-Prairies",
        "27": "Maurice-Duplessis / 63e Avenue",
        "28": "Maurice-Duplessis / 70e Avenue",
        "29": "Maurice-Duplessis / Olivier-Lejeune",
        "30": "Maurice-Duplessis / Saint-Jean-Baptiste",
        "31": "Gare Riviere-des-Prairies",
        "32": "Maurice-Duplessis / 86e Avenue",
        "33": "Maurice-Duplessis / Armand-Chaput",
        "34": "Armand-Chaput / No 11410",
        "35": "Armand-Chaput / No 11380",
        "36": "Armand-Chaput / Henri-Bourassa",
        "37": "Henri-Bourassa / 36e Avenue",
        "38": "Henri-Bourassa / 40e Avenue",
        "39": "Henri-Bourassa / Sherbrooke",
        "40": "Sherbrooke / 47e Avenue",
        "41": "Sherbrooke / de la Rousseliere",
        "42": "Sherbrooke / 53e Avenue",
        "43": "Gare Pointe-aux-Trembles"
    }
}