{
    "$schema": "./LineSchema.json",
    "frequent": true,
    "lineNumber": 103,
    "lineName": "Parc Industriel-Lachine",
    "from": "Terminus Saint-Pierre",
    "to": "Station Cote-Vertu",
    "stops": {
        "1": "Terminus Saint-Pierre",
        "2": "Saint-Jacques / Ouellette",
        "3": "Saint-Jacques / du Chalet",
        "4": "Saint-Jacques / Saint-Pierre",
        "5": "Saint-Jacques / Richardson",
        "6": "Saint-Jacques / Victoria",
        "7": "Victoria / 1e Avenue",
        "8": "1e Avenue / Saint-Antoine",
        "9": "1e Avenue / Provost",
        "10": "Provost / 3e Avenue",
        "11": "Provost / 5e Avenue",
        "12": "Provost / 7e Avenue",
        "13": "Provost / 9e Avenue",
        "14": "Provost / 11e Avenue",
        "15": "Provost / 13e Avenue",
        "16": "Provost / 16e Avenue",
        "17": "Provost / Esther-Blondin",
        "18": "Provost / 20e Avenue",
        "19": "Provost / 24e Avenue",
        "20": "Provost / 26e Avenue",
        "21": "Provost / 32e Avenue",
        "22": "Provost / 36e Avenue",
        "23": "Provost / 37e Avenue",
        "24": "Provost / 39e Avenue",
        "25": "Provost / 42e Avenue",
        "26": "Provost / 44e Avenue",
        "27": "Provost / Victoria",
        "28": "Victoria / 48e Avenue",
        "29": "Victoria / 50e Avenue",
        "30": "Victoria / Meadowbrook",
        "31": "Victoria / 52e Avenue",
        "32": "Victoria / 55e Avenue",
        "33": "55e Avenue / No 920",
        "34": "55e Avenue / No 1200",
        "35": "55e Avenue / Fairway",
        "36": "Fairway / 52e Avenue",
        "37": "Fairway / 50e Avenue",
        "38": "Fairway / 46e Avenue",
        "39": "Fairway / Francois-Lenoir",
        "40": "Fairway / 32e Avenue",
        "41": "32e Avenue / Jean-Baptiste-Deschamps",
        "42": "Jean-Baptiste-Deschamps / No 3245",
        "43": "Jean-Baptiste-Deschamps / Courval",
        "44": "Jean-Baptiste-Deschamps / No 2605",
        "45": "Jean-Baptiste-Deschamps / Hickmore",
        "46": "Hickmore / Courval",
        "47": "Hickmore / Montee de Liesse",
        "48": "Montee de Liesse / Hickmore",
        "49": "Montee de Liesse / No 110",
        "50": "Montee de Liesse / Bourg",
        "51": "Montee de Liesse / Cote-de-Liesse",
        "52": "Montee de Liesse / No 222",
        "53": "Montee de Liesse / No 360",
        "54": "Montee de Liesse / Reverchon",
        "55": "Montee de Liesse / No 750",
        "56": "Montee de Liesse / McCaffrey",
        "57": "Montee de Liesse / Cote-Vertu",
        "58": "Cote-Vertu / Begin",
        "59": "Cote-Vertu / No 3695",
        "60": "Cote-Vertu / Beaulac",
        "61": "Cote-Vertu / No 3200",
        "62": "Cote-Vertu / Cavendish",
        "63": "Cote-Vertu / Hocquart",
        "64": "Cote-Vertu / Bertrand",
        "65": "Cote-Vertu / Alexis-Nihon",
        "66": "Cote-Vertu / Saint-Aubin",
        "67": "Cote-Vertu / Marcel-Laurin",
        "68": "Cote-Vertu / Leduc",
        "69": "Cote-Vertu / Crevier",
        "70": "Station Cote-Vertu"
    }

}