{
    "$schema": "./LineSchema.json",
    "frequent": false,
    "lineNumber": 54,
    "lineName": "Saint-Michel",
    "from": "Station Henri-Bourassa",
    "to": "Station Pie-IX",
    "stops": {
        "1": "Station Henri-Bourassa",
        "2": "Henri-Bourassa / Saint-Hubert",
        "3": "Henri-Bourassa / Saint-Charles",
        "4": "Henri-Bourassa / de la Roche",
        "5": "Henri-Bourassa / Christophe-Colomb",
        "6": "Henri-Bourassa / Hamel",
        "7": "Henri-Bourassa / Francis",
        "8": "Henri-Bourassa / Tache",
        "9": "Henri-Bourassa / Papineau",
        "10": "Henri-Bourassa / Hamelin",
        "11": "Henri-Bourassa / De Lorimier",
        "12": "Henri-Bourassa / Parthenais",
        "13": "Henri-Bourassa / Rancourt",
        "14": "Henri-Bourassa / Bruchesi",
        "15": "Henri-Bourassa / Andre-Jobin",
        "16": "Henri-Bourassa / Vianney",
        "17": "Henri-Bourassa / J-J-Gagnier",
        "18": "Henri-Bourassa / Saint-Michel",
        "19": "Saint-Michel / Prieur",
        "20": "Saint-Michel / Fleury",
        "21": "Saint-Michel / de Mont-Joli",
        "22": "Saint-Michel / Industriel",
        "23": "Saint-Michel / Champdore",
        "24": "Saint-Michel / Louvain",
        "25": "Saint-Michel / Legendre",
        "26": "Saint-Michel / Emile-Journault",
        "27": "Saint-Michel / Denis-Papin",
        "28": "Saint-Michel / Robert",
        "29": "Saint-Michel / Deville",
        "30": "Saint-Michel / d'Herelle",
        "31": "Saint-Michel / Jarry",
        "32": "Station Saint-Michel",
        "33": "Saint-Michel / Jean-Talon",
        "34": "Jean-Talon / 12e Avenue",
        "35": "Jean-Talon / Musset",
        "36": "Jean-Talon / 15e Avenue",
        "37": "Jean-Talon / 17e Avenue",
        "38": "Jean-Talon / 18e Avenue",
        "39": "Jean-Talon / 20e Avenue",
        "40": "Jean-Talon / Pie-IX",
        "41": "Pie-IX / Belanger",
        "42": "Pie-IX / Saint-Zotique",
        "43": "Pie-IX / Beaubien",
        "44": "Pie-IX / Rosemont",
        "45": "Pie-IX / Dandurand",
        "46": "Pie-IX / Masson",
        "47": "Pie-IX / Laurier",
        "48": "Pie-IX / Saint-Joseph",
        "49": "Pie-IX / Mont-Royal",
        "50": "Pie-IX / Sherbrooke",
        "51": "Station Pie-IX"
    }
}