{
    "$schema": "./LineSchema.json",
    "frequent": false,
    "lineNumber": 204,
    "lineName": "Dollard-Des-Ormeaux",
    "from": "Gare Pointe-Claire",
    "to": "Gare Sunnybrooke",
    "stops": {
        "1": "Gare Pointe-Claire",
        "2": "Donegani / Terra-Cotta",
        "3": "Donegani / Maywood",
        "4": "Donegani / Eldorado",
        "5": "Donegani / Aurora",
        "6": "Aurora / Springdale",
        "7": "Aurora / Douglas-Shrand",
        "8": "Douglas-Shand / Saint-Jean",
        "9": "Saint-Jean / Duke-of-Kent",
        "10": "Saint-Jean / Sedgefield",
        "11": "Saint-Jean / Chaucer",
        "12": "Saint-Jean / Hymus",
        "13": "Saint-Jean / Holiday",
        "14": "Saint-Jean / Brunswick",
        "15": "Saint-Jean / Labrosse",
        "16": "Saint-Jean / Blue-Haven",
        "17": "Saint-Jean / Salaberry",
        "18": "Saint-Jean / Lake",
        "19": "Saint-Jean / Roger-Pilon",
        "20": "Roger-Pilon / Barnett",
        "21": "Roger-Pilon / Mirabel",
        "22": "Roger-Pilon / Armstrong",
        "23": "Roger-Pilon / Baffin",
        "24": "Roger-Pilon / Tecumseh",
        "25": "Roger-Pilon / Fredmir",
        "26": "Roger-Pilon / Manuel",
        "27": "Roger-Pilon / Westpark",
        "28": "Roger-Pilon / Dephoure",
        "29": "Roger-Pilon / Canterbury",
        "30": "Roger-Pilon / Merritt",
        "31": "Roger-Pilon / des Sources",
        "32": "des Sources / 14e Avenue",
        "33": "des Sources / 9e Avenue",
        "34": "des Sources / Anselme-Lavigne",
        "35": "des Sources / Ross",
        "36": "des Sources / Pierrefonds",
        "37": "des Sources / Gouin",
        "38": "Gouin / Pierrefonds",
        "39": "Gouin / 8e Avenue",
        "40": "Gouin / Meighen",
        "41": "Gouin / 3e Avenue",
        "42": "Gouin / 1e Avenue",
        "43": "Gouin / Lalande",
        "44": "Gouin / 2e Rue",
        "45": "Gouin / 1e Rue",
        "46": "Gouin / Dollard",
        "47": "Gouin / Deslauriers",
        "48": "Gare Sunnybrooke"
    }
}