{
    "$schema": "./LineSchema.json",
    "frequent": true,
    "lineNumber": 248,
    "lineName": "Gouin Est",
    "from": "Henri-Bourassa",
    "to": "Plage-de-l'Est",
    "stops": {
        "1": "Station Henri-Bourassa",
        "2": "Henri-Bourassa / Saint-Hubert",
        "3": "Henri-Bourassa / Saint-Charles",
        "4": "Henri-Bourassa / de la Roche",
        "5": "Henri-Bourassa / Christophe-Colomb",
        "6": "Henri-Bourassa / Hamel",
        "7": "Henri-Bourassa / Francis",
        "8": "Henri-Bourassa / Tache",
        "9": "Henri-Bourassa / Papineau",
        "10": "Henri-Bourassa / Hamelin",
        "11": "Henri-Bourassa / De Lorimier",
        "12": "Henri-Bourassa / Parthenais",
        "13": "Henri-Bourassa / Rancourt",
        "14": "Henri-Bourassa / Bruchesi",
        "15": "Henri-Bourassa / Andre-Jobin",
        "16": "Henri-Bourassa / Vianney",
        "17": "Henri-Bourassa / J-J-Gagnier",
        "18": "Henri-Bourassa / Saint-Michel",
        "19": "Saint-Michel / Gouin",
        "20": "Gouin / Mackay",
        "21": "Gouin / Audoin",
        "22": "Gouin / Leblanc",
        "23": "Gouin / Lausanne",
        "24": "Gouin / de Mere-Anselme",
        "25": "Gouin / des Laurentides",
        "26": "Gouin / de Bruxelles",
        "27": "Gouin / Plaza",
        "28": "Gouin / de London",
        "29": "Gouin / Gariepy",
        "30": "Gouin / Saint-Julien",
        "31": "Gouin / de l'Hotel-de-Ville",
        "32": "Gouin / Pelletier",
        "33": "Gouin / Balzac",
        "34": "Gouin / Ethier",
        "35": "Gouin / Pigeon",
        "36": "Gouin / Sainte-Gertrude",
        "37": "Gouin / Desaulniers",
        "38": "Gouin / Brunet",
        "39": "Gouin / Alfred",
        "40": "Gouin / Salk",
        "41": "Gouin / Lanthier",
        "42": "Gouin / Lacordaire",
        "43": "Gouin / Hector-Lamarre",
        "44": "Gouin / Robert",
        "45": "Gouin / Corbeil",
        "46": "Gouin / Veuillot",
        "47": "Gouin / Langelier",
        "48": "Langelier / Leger",
        "49": "Leger / Albert-Hudon",
        "50": "Perras / 4e Avenue",
        "51": "Perras / Pierre-Blanchet",
        "52": "Perras / Gilbert-Barbier",
        "53": "Perras / Aurele-Fortin",
        "54": "Perras / Fernand-Gauthier",
        "55": "Perras / Elle Beauregard",
        "56": "Perras / Salomon-Marion",
        "57": "Perras / Armand-Bombardier",
        "58": "24e Avenue / Gouin",
        "59": "Gouin / 27e Avenue",
        "60": "Gouin / Paul-Dufault",
        "61": "Parc Pierre-Perrault",
        "62": "Gouin / Rita-Levi-Montalcini",
        "63": "Gouin / 39e Avenue",
        "64": "Gouin / 41e Avenue",
        "65": "Gouin / Rodolphe-Forget",
        "66": "Gouin / 48e Avenue",
        "67": "Gouin / 52e Avenue",
        "68": "Gouin / 54e Avenue",
        "69": "Gouin / 56e Avenue",
        "70": "Gouin / Riviere-des-Prairies",
        "71": "Parc Zotique-Saint-Jean",
        "72": "Gouin / 64e Avenue",
        "73": "Gouin / 66e Avenue",
        "74": "Gouin / 71e Avenue",
        "75": "Gouin / Francois-Huot",
        "76": "Gouin / d'Alembert",
        "77": "Gouin / Saint-Jean-Baptiste",
        "78": "Gouin / Cageux Park",
        "79": "Gouin / 89e Avenue",
        "80": "Gouin / 94e Avenue",
        "81": "Parc Ile Haynes",
        "82": "Gouin / 133e Avenue",
        "83": "Gouin / Prince Arthur",
        "84": "Gouin / Sherbrooke",
        "85": "Sherbrooke / Notre-Dame",
        "86": "Notre-Dame / Sainte-Maria-Goretti",
        "87": "Plage-de-l'Est"
    }
}