{
    "$schema": "./LineSchema.json",
    "frequent": false,
    "lineNumber": 13,
    "lineName": "La Ronde via Bd LaSalle",
    "from": "Ecluse de Lachine",
    "to": "La Ronde",
    "stops": {
        "1": "Ecluse de Lachine (Saint Patrick / du Musee)",
        "2": "du Musee / Lyette",
        "3": "LaSalle / Av Dupras",
        "4": "LaSalle / Av Strathyre",
        "5": "LaSalle / Highlands (Gare LaSalle)",
        "6": "LaSalle / des Oblats",
        "7": "LaSalle / du Tresor Cache",
        "8": "LaSalle / Av Lafleur",
        "9": "LaSalle / Av Orchard",
        "10": "LaSalle / 90e Avenue",
        "11": "LaSalle / Av. 80e",
        "12": "LaSalle / 75e Avenue",
        "13": "LaSalle / 68e Avenue",
        "14": "LaSalle / 66e Avenue",
        "15": "LaSalle / Champlain Blvd",
        "16": "LaSalle / 43e Avenue",
        "17": "LaSalle / 37e Avenue",
        "18": "LaSalle / Raymond",
        "19": "LaSalle / Gagne",
        "20": "LaSalle / Bd Bishop-Power",
        "21": "LaSalle / 8e Ave",
        "22": "LaSalle / 6e Ave",
        "23": "LaSalle / 4e Ave",
        "24": "LaSalle / 2e Ave",
        "25": "LaSalle / Av Alepin",
        "26": "LaSalle / Av Lacharite",
        "27": "LaSalle / Av Senecal",
        "28": "LaSalle / Fayolle",
        "29": "LaSalle / Clemenceau",
        "30": "LaSalle / Crawford",
        "31": "LaSalle / Leclair",
        "32": "LaSalle / No 6875",
        "33": "LaSalle / Bannantyne",
        "34": "LaSalle / Rolland",
        "35": "LaSalle / Valiquette",
        "36": "LaSalle / Ave Riverview",
        "37": "LaSalle / Brault",
        "38": "LaSalle / Manning",
        "39": "LaSalle / Beatty (Wellington)",
        "40": "LaSalle / Woodland",
        "41": "LaSalle / Desmarchais Blvd",
        "42": "LaSalle / 5e Avenue",
        "43": "LaSalle / 4e Avenue",
        "44": "LaSalle / 3e Avenue",
        "45": "LaSalle / 1ere Avenue",
        "46": "LaSalle / Rielle",
        "47": "LaSalle / Galt et de l'Eglise",
        "48": "LaSalle / Hickson",
        "49": "LaSalle / Wellington",
        "50": "Wellington / Gilberte-Dube",
        "51": "Wellington / Butler",
        "52": "Wellington / Charlevoix",
        "53": "Parc Marguerite Bourgeoys",
        "54": "Wellington / Fortune",
        "55": "Wellington / Charon",
        "56": "Wellington / Ste Madeleine",
        "57": "Wellington / de la Congregation",
        "58": "Wellington / Mullins",
        "59": "Wellington / Centre",
        "60": "Wellington / Bridge",
        "61": "Bridge / Mill",
        "62": "Pierre-Dupuy / Des Moulins",
        "63": "Pierre-Dupuy / Habitat 67",
        "64": "La Ronde"
    }
}