{
    "$schema": "./LineSchema.json",
    "frequent": false,
    "lineNumber": 129,
    "lineName": "Saint-Jean-Baptiste",
    "from": "Sherbrooke / du Tricentenaire",
    "to": "Gare Riviere-des-Prairies",
    "stops": {
        "1": "Sherbrooke / du Tricentenaire",
        "2": "du Tricentenaire / Forsyth",
        "3": "du Tricentenaire / de Montigny",
        "4": "du Tricentenaire / Joseph-d'Argent",
        "5": "du Tricentenaire / Rene-Levesque",
        "6": "du Tricentenaire / Victoria",
        "7": "du Tricentenaire / Notre-Dame",
        "8": "Notre-Dame / No 12625",
        "9": "Notre-Dame / 19e Avenue",
        "10": "Notre-Dame / 16e Avenue",
        "11": "Notre-Dame / 14e Avenue",
        "12": "Notre-Dame / Saint-Jean-Baptiste",
        "13": "Saint-Jean-Baptiste / Victoria",
        "14": "Saint-Jean-Baptiste / de la Gauchetiere",
        "15": "Saint-Jean-Baptiste / Rene-Levesque",
        "16": "Place Pointe-aux-Trembles",
        "17": "Saint-Jean-Baptiste / de Montigny",
        "18": "Saint-Jean-Baptiste / Ontario",
        "19": "Saint-Jean-Baptiste / Sherbrooke",
        "20": "Saint-Jean-Baptiste / Industriel",
        "21": "Saint-Jean-Baptiste / Urgel-Charbonneau",
        "22": "Saint-Jean-Baptiste / Henri-Bourassa",
        "23": "Saint-Jean-Baptiste / No 10905",
        "24": "Saint-Jean-Baptiste / Armand-Chaput",
        "25": "Armand-Chaput / No 11410",
        "26": "Centre Riviere-des-Prairies",
        "27": "Armand-Chaput / Rolland-Jeanneau",
        "28": "89e Avenue / Maurice-Duplessis",
        "29": "Maurice-Duplessis / 87e Avenue",
        "30": "Gare Riviere-des-Prairies"
    }
}