{
    "$schema": "./LineSchema.json",
    "frequent": false,
    "lineNumber": 202,
    "lineName": "Ile-Bizard",
    "from": "Ile-Mercier",
    "to": "LOOP",
    "stops": {
        "1": "Ile-Mercier",
        "2": "Mercier / Louis-Roch",
        "3": "Louis-Roch / Cherrier",
        "4": "Cherrier / de l'Eglise",
        "5": "Cherrier / Dollard",
        "6": "Cherrier / des Pres",
        "7": "Cherrier / du Pont",
        "8": "Cherrier / Jacques Bizard",
        "9": "Cherrier / Saint-Pierre",
        "10": "Cherrier / de Blanzy",
        "11": "Cherrier / Soupras",
        "12": "Cherrier / Leo-Lorrain",
        "13": "Cherrier / Pierre-Foretier",
        "14": "Cherrier / Proulx",
        "15": "Cherrier / Triolet",
        "16": "Cherrier / Emile",
        "17": "Cherrier / Chaurset",
        "18": "Cherrier / Begin",
        "19": "Dutour / des Ormes",
        "20": "Dutour / des Vinaigriers",
        "21": "Dutour / des Aulnes",
        "22": "Dutour / Noyers",
        "23": "Dutour / des Erables",
        "24": "Dutour / Patenaude",
        "25": "Bord-du-Lac / Latraverse",
        "26": "Bord-du-Lac / Blouin",
        "27": "Bord-du-Lac / 2e Avenue",
        "28": "Bord-du-Lac / 4e Avenue",
        "29": "Bord-du-Lac / No 2317",
        "30": "Bord-du-Lac / No 2305",
        "31": "Bord-du-Lac / Boismeru",
        "32": "Bord-du-Lac / Bord-du-Lac",
        "33": "Bord-du-Lac / des Cageux",
        "34": "Bord-du-Lac / Phillippe-Delisle",
        "35": "Bord-du-Lac / Chateauneuf",
        "36": "Bord-du-Lac / Beaudet",
        "37": "Bord-du-Lac / de l'Eglise",
        "38": "de l'Eglise / du Golf",
        "39": "de l'Eglise / Alphonse-Desjardins",
        "40": "de l'Eglise / North Ridge",
        "41": "de l'Eglise / No 985",
        "42": "de l'Eglise / South Ridge",
        "43": "de l'Eglise / Robert N",
        "44": "de l'Eglise / Louise-Bizard",
        "45": "de l'Eglise / Robert S",
        "46": "de l'Eglise / Chevremont",
        "47": "Ecole Jacques-Bizard",
        "48": "de l'Eglise / Cherrier",
        "49": "Cherrier / Louis-Roch",
        "50": "Louis-Roch / Mercier",
        "51": "Ile-Mercier"
    }
}