{
    "$schema": "./LineSchema.json",
    "frequent": false,
    "lineNumber": 73,
    "lineName": "Hochelaga",
    "from": "Station Frontenac",
    "to": "Station Honore-Beaugrand",
    "stops": {
        "1": "Station Frontenac",
        "2": "Frontenac / de Rouen",
        "3": "Frontenac / Hochelaga",
        "4": "Hochelaga / Hogan",
        "5": "Hochelaga / Florian",
        "6": "Station Prefontaine",
        "7": "Hochelaga / Dezery",
        "8": "Hochelaga / Davidson",
        "9": "Station Joliette",
        "10": "Hochelaga / Nicolet",
        "11": "Hochelaga / Bourbonniere",
        "12": "Hochelaga / Charlemagne",
        "13": "Hochelaga / Pie-IX",
        "14": "Hochelaga / de la Salle",
        "15": "Hochelaga / Bennett",
        "16": "Hochelaga / Sicard",
        "17": "Hochelaga / Theodore",
        "18": "Hochelaga / Viau",
        "19": "Hochelaga / Assomption",
        "20": "Hochelaga / Dickson",
        "21": "Hochelaga / Lacordaire",
        "22": "Hochelaga / Bossuet",
        "23": "Hochelaga / du Quesne",
        "24": "Polyvalent Edouard-Montpetit",
        "25": "Hochelaga / Langelier",
        "26": "Hochelaga / Desautels",
        "27": "Hochelaga / Haig",
        "28": "Hochelaga / Beauclerk",
        "29": "Centre Fernand-Seguin",
        "30": "Hochelaga / No 7401",
        "31": "Hochelaga / Lepailleur",
        "32": "Hochelaga / Honore-Beaugrand",
        "33": "Hochelaga / Liebert",
        "34": "Hochelaga / Lapointe",
        "35": "Hochelaga / Mercier",
        "36": "Hochelaga / Baldwin",
        "37": "Hochelaga / des Ormeaux",
        "38": "Hochelaga / Joffre",
        "39": "Hochelaga / Pierre-Bernand",
        "40": "Hochelaga / Taillon",
        "41": "Hochelaga / Aubry",
        "42": "Hochelaga / Fletcher",
        "43": "Hochelaga / de Contrecoeur",
        "44": "Hochelaga / Georges-V",
        "45": "Georges-V / Sainte-Claire",
        "46": "Georges-V / Sherbrooke",
        "47": "Sherbrooke / Hector",
        "48": "Sherbrooke / Bilaudeau",
        "49": "Sherbrooke / Jacques-Porlier",
        "50": "Sherbrooke / Paul-Pau",
        "51": "Sherbrooke / Desmarteau",
        "52": "Sherbrooke / Joffre",
        "53": "Sherbrooke / des Ormeaux",
        "54": "Sherbrooke / Balwdin",
        "55": "Sherbrooke / Mercier",
        "56": "Sherbrooke / Lapointe",
        "57": "Sherbrooke / Liebert",
        "58": "Station Honore-Beaugrand"
    }
}